{
  "$schema": "https://json-schema.org/draft/2020-12/schema",
  "$id": "preset.schema.json",
  "title": "characters/presets/<name>.json: a ready-made character (CATALOG_SPEC 4.1).",
  "type": "object",
  "required": ["id", "name", "description", "role", "tags", "audience", "cast"],
  "additionalProperties": false,
  "properties": {
    "id": { "$ref": "common.schema.json#/$defs/ownName" },
    "name": { "type": "string", "minLength": 1, "maxLength": 16, "pattern": "^[A-Za-z][A-Za-z0-9 '.-]{0,15}$" },
    "description": { "$ref": "common.schema.json#/$defs/description" },
    "role": { "enum": ["hero", "sidekick", "friend", "family", "mentor", "villain", "henchman", "rival", "guard", "crowd", "animal-like"] },
    "tags": { "$ref": "common.schema.json#/$defs/tags" },
    "series": { "type": "string", "pattern": "^[a-z][a-z0-9_]{0,31}$", "description": "The series this character belongs to; the context pack lists series presets by id only." },
    "audience": { "$ref": "common.schema.json#/$defs/audience" },
    "cast": {
      "type": "object", "required": ["color"], "additionalProperties": false,
      "properties": {
        "body": { "$ref": "common.schema.json#/$defs/ref" },
        "color": { "$ref": "common.schema.json#/$defs/hex" },
        "scale": { "type": "number", "minimum": 0.4, "maximum": 4 },
        "hp": { "type": "number", "minimum": 1, "maximum": 1000 },
        "prop": { "type": ["string", "null"], "pattern": "^([a-z][a-z0-9_]{2,31}:[a-z][a-z0-9_]{0,31}|[a-z][a-z0-9_]{0,31})$" },
        "appearance": {
          "type": "object", "additionalProperties": false,
          "properties": {
            "eyes": { "enum": ["dot", "big", "oval", "sleepy", "visor", "glasses", "lively"] },
            "brows": { "enum": ["none", "thin", "thick"] },
            "mouthStyle": { "enum": ["line", "cartoon", "big_grin", "toothy"] },
            "cheeks": { "$ref": "common.schema.json#/$defs/hex" },
            "hair": { "enum": ["none", "spiky", "bob", "ponytail", "cap", "bun"] },
            "hairColor": { "$ref": "common.schema.json#/$defs/hex" },
            "outfit": { "enum": ["none", "shirt", "coat", "armor", "robe"] },
            "outfitColor": { "$ref": "common.schema.json#/$defs/hex" },
            "belly": { "$ref": "common.schema.json#/$defs/hex" },
            "slots": { "type": "integer", "minimum": 0, "maximum": 7 },
            "accessories": {
              "type": "object", "additionalProperties": false, "maxProperties": 4,
              "properties": {
                "headband": { "$ref": "common.schema.json#/$defs/hex" }, "scarf": { "$ref": "common.schema.json#/$defs/hex" },
                "cape": { "$ref": "common.schema.json#/$defs/hex" }, "hat": { "$ref": "common.schema.json#/$defs/hex" },
                "antenna": { "$ref": "common.schema.json#/$defs/hex" }, "bowtie": { "$ref": "common.schema.json#/$defs/hex" },
                "mask": { "$ref": "common.schema.json#/$defs/hex" }, "crown": { "$ref": "common.schema.json#/$defs/hex" },
                "backpack": { "$ref": "common.schema.json#/$defs/hex" }, "eyepatch": { "$ref": "common.schema.json#/$defs/hex" },
                "hair_flower": { "$ref": "common.schema.json#/$defs/hex" }, "sprout": { "$ref": "common.schema.json#/$defs/hex" },
                "mittens": { "$ref": "common.schema.json#/$defs/hex" }, "horns": { "$ref": "common.schema.json#/$defs/hex" },
                "turban": { "$ref": "common.schema.json#/$defs/hex" }, "moustache": { "$ref": "common.schema.json#/$defs/hex" },
                "stub_horns": { "$ref": "common.schema.json#/$defs/hex" }, "bracelet": { "$ref": "common.schema.json#/$defs/hex" }, "chilli_hat": { "$ref": "common.schema.json#/$defs/hex" }, "pirate_hat": { "$ref": "common.schema.json#/$defs/hex" }, "beard": { "$ref": "common.schema.json#/$defs/hex" }, "windup_key": { "$ref": "common.schema.json#/$defs/hex" },
                "leaf_sprout": { "$ref": "common.schema.json#/$defs/hex" }, "curly_vine": { "$ref": "common.schema.json#/$defs/hex" }, "flower_bud": { "$ref": "common.schema.json#/$defs/hex" }, "flower_bloom": { "$ref": "common.schema.json#/$defs/hex" }, "party_hat": { "$ref": "common.schema.json#/$defs/hex" }, "whistle": { "$ref": "common.schema.json#/$defs/hex" }, "clipboard": { "$ref": "common.schema.json#/$defs/hex" }, "gloss": { "$ref": "common.schema.json#/$defs/hex" }, "shoes": { "$ref": "common.schema.json#/$defs/hex" }
              }
            }
          }
        },
        "voice": {
          "type": "object", "additionalProperties": false,
          "properties": {
            "pitch": { "type": "number", "minimum": 0.5, "maximum": 2 },
            "speed": { "type": "number", "minimum": 0.7, "maximum": 1.4 },
            "timbre": { "enum": ["soft", "squeaky", "deep", "robot", "bark"] }
          }
        },
        "style": {
          "type": "object", "additionalProperties": false,
          "properties": {
            "overlap": { "type": "boolean" }, "outline": { "type": "boolean" }, "squash": { "type": "boolean" },
            "glow": { "$ref": "common.schema.json#/$defs/hex" }, "headband": { "$ref": "common.schema.json#/$defs/hex" },
            "cape": { "$ref": "common.schema.json#/$defs/hex" }, "hat": { "$ref": "common.schema.json#/$defs/hex" },
            "scarf": { "$ref": "common.schema.json#/$defs/hex" }
          }
        }
      }
    }
  }
}
