{
  "id": "mirchi",
  "name": "Madam Mirchi",
  "description": "A spice sorceress in a red robe and a tall chilli hat; her chilli smoke makes everyone sneeze, but she can't stand sweets.",
  "role": "villain",
  "tags": ["villain", "spice", "funny", "magic"],
  "series": "doopi",
  "audience": ["kids", "general"],
  "cast": {
    "body": "slim",
    "color": "#ffb08a",
    "appearance": {"eyes": "oval", "brows": "thick", "mouthStyle": "cartoon", "outfit": "robe", "outfitColor": "#e63946", "accessories": {"chilli_hat": "#e63946"}},
    "voice": {"pitch": 1.25, "speed": 1.15, "timbre": "squeaky"}
  }
}
