{
  "id": "peepa",
  "name": "Peepa",
  "description": "Tall dark-violet villain with curly golden ram horns, thick brows and a long dark cape; dramatic, vain and lonely.",
  "role": "villain",
  "tags": ["villain", "dramatic", "vain"],
  "series": "doopi",
  "audience": ["kids", "general"],
  "cast": {
    "body": "slim",
    "scale": 1.15,
    "color": "#c9a6ff",
    "appearance": {"eyes": "oval", "brows": "thick", "accessories": {"horns": "#e6b84a", "cape": "#2a1b3d"}},
    "voice": {"pitch": 0.7, "speed": 0.95, "timbre": "deep"}
  }
}
