{
  "id": "motumal",
  "name": "Motumal",
  "description": "Tokyo's round, pompous mayor with a big moustache, a saffron turban and an orange coat; kind and scared of everything.",
  "role": "friend",
  "tags": ["pompous", "kind", "scared", "funny"],
  "series": "doopi",
  "audience": ["kids", "general"],
  "cast": {
    "body": "bulky",
    "color": "#e07b39",
    "appearance": {"outfit": "coat", "outfitColor": "#ff9f1c", "accessories": {"moustache": "#2a1a14", "turban": "#f6c445"}},
    "voice": {"pitch": 0.75, "speed": 0.9, "timbre": "deep"}
  }
}
