{
  "id": "mooka",
  "name": "Mooka",
  "description": "A round mint-green jelly-bean buddy with a leaf sprout, a lavender belly and orange mittens; giggly and innocent.",
  "role": "sidekick",
  "tags": ["cute", "funny", "innocent", "small"],
  "series": "doopi",
  "audience": ["kids", "general"],
  "cast": {
    "body": "buddy",
    "scale": 0.85,
    "color": "#7fe8c4",
    "appearance": {"eyes": "big", "mouthStyle": "cartoon", "cheeks": "#ffb3c7", "belly": "#c9b6ff", "accessories": {"sprout": "#3fae5a", "mittens": "#ff9f43"}},
    "voice": {"pitch": 1.9, "speed": 1.3, "timbre": "squeaky"}
  }
}
