{
  "id": "nani",
  "name": "Nani Nimbu",
  "description": "A tiny stooped granny with a white bun, round glasses and a purple shawl; strict, funny, spins her cane like a staff.",
  "role": "mentor",
  "tags": ["wise", "strict", "funny", "elder"],
  "series": "doopi",
  "audience": ["kids", "general"],
  "cast": {
    "body": "elder",
    "scale": 0.9,
    "color": "#e8a87c",
    "prop": "cane",
    "appearance": {"eyes": "glasses", "hair": "bun", "hairColor": "#f2f2f2", "outfit": "robe", "outfitColor": "#8e5bd6"},
    "voice": {"pitch": 1.1, "speed": 0.85, "timbre": "soft"}
  }
}
