{
  "id": "zizi",
  "name": "Zizi",
  "description": "The tiny Baaaana mischief maker: sea-green, a curly vine on top and a backpack of gadgets that work once and then go wild.",
  "role": "friend",
  "tags": [
    "tiny",
    "quick",
    "cheeky",
    "inventor",
    "baaaana"
  ],
  "series": "baaaana",
  "audience": [
    "kids",
    "general"
  ],
  "cast": {
    "body": "baaaana",
    "scale": 0.7,
    "color": "#5cc9a0",
    "appearance": {
      "eyes": "big",
      "mouthStyle": "cartoon",
      "cheeks": "#ffb3c7",
      "belly": "#c9b6ff",
      "accessories": {
        "mittens": "#ff9f43",
        "shoes": "#ff9f43",
        "gloss": "#ffffff",
        "curly_vine": "#3fae5a",
        "backpack": "#ffb347"
      }
    },
    "voice": {
      "pitch": 2.0,
      "speed": 1.4,
      "timbre": "squeaky"
    }
  }
}
