{
  "id": "robo_pals:bolt",
  "name": "Bolt",
  "description": "A cheerful blue helper robot who loves to dance and fix things.",
  "role": "friend",
  "tags": [
    "robot",
    "helper",
    "cheerful"
  ],
  "audience": [
    "kids",
    "general"
  ],
  "cast": {
    "body": "robo_pals:boxbot",
    "color": "#3d7bd9",
    "appearance": {
      "accessories": {
        "antenna": "#ffcc33"
      }
    },
    "voice": {
      "pitch": 1.1,
      "timbre": "robot"
    }
  }
}
