{
  "id": "kony",
  "name": "Kony",
  "description": "Tony's softer almost-twin in grey with a blue cap and glued-on stub horns; a bit kind, Mooka's secret friend.",
  "role": "henchman",
  "tags": ["henchman", "soft", "funny"],
  "series": "doopi",
  "audience": ["kids", "general"],
  "cast": {
    "body": "kid",
    "scale": 0.8,
    "color": "#9a9aa8",
    "appearance": {"hair": "cap", "hairColor": "#3a6fd8", "accessories": {"stub_horns": "#7a6a99"}},
    "voice": {"pitch": 1.7, "speed": 1.1, "timbre": "squeaky"}
  }
}
