{
  "id": "dony",
  "name": "Dony",
  "description": "Doopi's loyal best friend in leaf green with a yellow cap and scarf; a worrier who always shares his food.",
  "role": "friend",
  "tags": ["loyal", "kind", "worrier"],
  "series": "doopi",
  "audience": ["kids", "general"],
  "cast": {
    "body": "kid",
    "scale": 1.1,
    "color": "#4cd964",
    "appearance": {"hair": "cap", "hairColor": "#ffcc00", "accessories": {"scarf": "#ffcc00"}},
    "voice": {"pitch": 1.15, "speed": 1.0, "timbre": "soft"}
  }
}
