{
  "id": "goon",
  "name": "Grey Goon",
  "description": "One of Peepa's grey helpers: a big, slow, silly guard in grey armour who is easy to trick.",
  "role": "henchman",
  "tags": ["villain", "henchman", "funny", "guard"],
  "series": "doopi",
  "audience": ["kids", "general"],
  "cast": {
    "body": "bulky",
    "color": "#e8e0f0",
    "appearance": {"eyes": "sleepy", "outfit": "armor", "outfitColor": "#8a8496"},
    "voice": {"pitch": 0.7, "speed": 0.85, "timbre": "deep"}
  }
}
