{
  "id": "kanta",
  "name": "Captain Kanta",
  "description": "A loud pirate captain in a navy coat, an eyepatch and a fish-badge tricorn; loves treasure and hates baths.",
  "role": "villain",
  "tags": ["villain", "pirate", "funny", "sea"],
  "series": "doopi",
  "audience": ["kids", "general"],
  "cast": {
    "body": "stickman",
    "color": "#9ad1d4",
    "prop": "sword",
    "appearance": {"eyes": "big", "brows": "thick", "outfit": "coat", "outfitColor": "#1d3557", "accessories": {"pirate_hat": "#1d3557", "eyepatch": "#111111", "moustache": "#2a1a14"}},
    "voice": {"pitch": 0.85, "speed": 1.05, "timbre": "deep"}
  }
}
