{
  "id": "tam",
  "name": "Tam",
  "description": "A playful kid with spiky hair who loves ball games.",
  "role": "friend",
  "tags": ["kid", "playful", "sporty"],
  "audience": ["kids", "general"],
  "cast": {
    "body": "kid",
    "color": "#ff8c1a",
    "appearance": { "hair": "spiky", "hairColor": "#3a2a1a" },
    "voice": { "pitch": 1.4, "timbre": "soft" }
  }
}
