{
  "id": "doomi",
  "name": "Doomi",
  "description": "Clever pink planner with a ponytail and a flower clip; kind to everyone, great at puzzles, ribbons and flips.",
  "role": "friend",
  "tags": ["clever", "kind", "planner"],
  "series": "doopi",
  "audience": ["kids", "general"],
  "cast": {
    "body": "stickman",
    "color": "#ff9ccc",
    "appearance": {"eyes": "big", "mouthStyle": "cartoon", "hair": "ponytail", "hairColor": "#5a3a2c", "cheeks": "#ff9db8", "outfit": "shirt", "outfitColor": "#ffd1e3", "accessories": {"hair_flower": "#ffffff"}},
    "voice": {"pitch": 1.35, "speed": 1.0, "timbre": "soft"}
  }
}
