{
  "id": "becky",
  "name": "Becky",
  "description": "A brave little cream puppy with a brown eye patch and a red collar; sniffs out trouble and barks first.",
  "role": "animal-like",
  "tags": ["dog", "pet", "brave", "cute"],
  "audience": ["kids", "general"],
  "cast": {
    "body": "dog_small",
    "color": "#f3e3c3",
    "appearance": { "eyes": "big" },
    "voice": { "pitch": 1.4, "timbre": "bark" }
  }
}
