{
  "id": "tutu",
  "name": "Tutu",
  "description": "The chubby Baaaana with the big heart: lime-mint, a flower bud on top that blooms when happy; strongest, gentlest, loves food and dancing.",
  "role": "friend",
  "tags": [
    "chubby",
    "strong",
    "gentle",
    "foodie",
    "baaaana"
  ],
  "series": "baaaana",
  "audience": [
    "kids",
    "general"
  ],
  "cast": {
    "body": "baaaana_wide",
    "scale": 0.95,
    "color": "#a6e88a",
    "appearance": {
      "eyes": "big",
      "mouthStyle": "cartoon",
      "cheeks": "#ffb3c7",
      "belly": "#c9b6ff",
      "accessories": {
        "mittens": "#ff9f43",
        "shoes": "#ff9f43",
        "gloss": "#ffffff",
        "flower_bud": "#ff7eb6"
      }
    },
    "voice": {
      "pitch": 1.3,
      "speed": 0.9,
      "timbre": "soft"
    }
  }
}
