{
  "id": "bn_mooka",
  "name": "Mooka",
  "description": "The little Baaaana: a round mint jelly bean with one big leaf on top; innocent, giggly, copies everyone and falls asleep at the worst time.",
  "role": "hero",
  "tags": [
    "cute",
    "funny",
    "innocent",
    "small",
    "baaaana"
  ],
  "series": "baaaana",
  "audience": [
    "kids",
    "general"
  ],
  "cast": {
    "body": "baaaana",
    "scale": 0.85,
    "color": "#7fe8c4",
    "appearance": {
      "eyes": "lively",
      "mouthStyle": "big_grin",
      "cheeks": "#ffb3c7",
      "belly": "#c9b6ff",
      "accessories": {
        "mittens": "#ff9f43",
        "shoes": "#ff9f43",
        "gloss": "#ffffff",
        "leaf_sprout": "#3fae5a"
      }
    },
    "voice": {
      "pitch": 1.9,
      "speed": 1.3,
      "timbre": "squeaky"
    }
  }
}
