{
  "id": "doopi",
  "name": "Doopi",
  "description": "The sky-blue hero of Tokyo: spiky hair, a red headband, big eyes; big-hearted, brave and very clumsy.",
  "role": "hero",
  "tags": ["brave", "clumsy", "kind", "funny"],
  "series": "doopi",
  "audience": ["kids", "general"],
  "cast": {
    "body": "stickman",
    "color": "#5ec8ff",
    "appearance": {"eyes": "big", "hair": "spiky", "hairColor": "#2a1a14", "mouthStyle": "cartoon", "accessories": {"headband": "#ff3b5c"}},
    "voice": {"pitch": 1.0, "speed": 1.05, "timbre": "soft"}
  }
}
