{
  "id": "bobo",
  "name": "Bobo",
  "description": "The tall, thin Baaaana planner: teal-mint, a two-leaf sprout, a whistle and a clipboard; big plans that always go wrong.",
  "role": "friend",
  "tags": [
    "tall",
    "worrier",
    "planner",
    "funny",
    "baaaana"
  ],
  "series": "baaaana",
  "audience": [
    "kids",
    "general"
  ],
  "cast": {
    "body": "baaaana_tall",
    "scale": 1.0,
    "color": "#6fd6c8",
    "appearance": {
      "eyes": "big",
      "mouthStyle": "cartoon",
      "cheeks": "#ffb3c7",
      "belly": "#c9b6ff",
      "accessories": {
        "mittens": "#ff9f43",
        "shoes": "#ff9f43",
        "gloss": "#ffffff",
        "sprout": "#3fae5a",
        "whistle": "#e63946",
        "clipboard": "#c98a4b"
      }
    },
    "voice": {
      "pitch": 1.5,
      "speed": 1.0,
      "timbre": "soft"
    }
  }
}
