{
  "id": "vex",
  "name": "Vex",
  "description": "A tall, thin villain in a black cape with a deep voice; tougher than most (200 hp).",
  "role": "villain",
  "tags": ["sneaky", "magic", "boss"],
  "audience": ["kids", "general"],
  "cast": {
    "body": "slim",
    "color": "#8a2be2",
    "style": { "cape": "#1a1a1a" },
    "appearance": { "eyes": "oval", "brows": "thick" },
    "voice": { "pitch": 0.7, "timbre": "deep" },
    "hp": 200
  }
}
