{
  "id": "tara",
  "name": "Tara Treetop",
  "description": "A brave, bossy forest girl in orange with a ponytail and a green scarf; knows every path in the Whispering Forest.",
  "role": "friend",
  "tags": ["brave", "bossy", "forest", "climber"],
  "series": "doopi",
  "audience": ["kids", "general"],
  "cast": {
    "body": "kid",
    "color": "#ffa45c",
    "appearance": {"eyes": "big", "hair": "ponytail", "hairColor": "#3a2414", "accessories": {"scarf": "#3fae5a"}},
    "voice": {"pitch": 1.45, "speed": 1.1, "timbre": "soft"}
  }
}
