{
  "id": "bo",
  "name": "Grandpa Bo",
  "description": "A kind grandpa who runs the corner shop; a friendly face in town scenes.",
  "role": "family",
  "tags": ["kind", "old", "shopkeeper"],
  "audience": ["kids", "general"],
  "cast": {
    "body": "elder",
    "color": "#c2185b",
    "appearance": { "outfit": "coat", "outfitColor": "#f2c14e", "eyes": "glasses" },
    "voice": { "pitch": 0.9, "timbre": "soft" }
  }
}
