{
  "id": "guard",
  "name": "Guard",
  "description": "A broad yellow guard who blocks the way; good in groups (guard1, guard2...).",
  "role": "guard",
  "tags": ["big", "strong"],
  "audience": ["kids", "general"],
  "cast": { "body": "bulky", "color": "#ffe14d", "voice": { "pitch": 0.75, "timbre": "deep" } }
}
