{
  "id": "mallu",
  "name": "Mallu Uncle",
  "description": "A cheerful old boatman with a round white beard and a white cap; he rows the friends across Lotus Lake.",
  "role": "mentor",
  "tags": ["kind", "old", "boat", "funny"],
  "series": "doopi",
  "audience": ["kids", "general"],
  "cast": {
    "body": "elder",
    "color": "#ffc2a0",
    "appearance": {"eyes": "big", "hair": "cap", "hairColor": "#f4f1de", "outfit": "shirt", "outfitColor": "#2a8f7c", "accessories": {"beard": "#f4f1de"}},
    "voice": {"pitch": 0.9, "speed": 0.9, "timbre": "deep"}
  }
}
