{
  "id": "pip",
  "name": "Pip",
  "description": "Kai's small round buddy with an antenna and a squeaky voice; cheerful and a bit clumsy.",
  "role": "sidekick",
  "tags": ["cute", "funny", "loyal"],
  "audience": ["kids", "general"],
  "cast": {
    "body": "buddy",
    "color": "#2fd3c0",
    "appearance": { "eyes": "big", "accessories": { "antenna": "#ffcc00" } },
    "voice": { "pitch": 1.5, "timbre": "squeaky" }
  }
}
